{
  "schema_version": 1,
  "switch": {
    "id": "switch1",
    "name": "Switch 1",
    "model": "Cisco ESS 3300"
  },
  "defaults": {
    "copper": {
      "expect": {
        "link": "up",
        "duplex": "full"
      }
    }
  },
  "unlisted_ports": "warn_if_up",
  "ports": [
    {
      "interface": "GigabitEthernet1/3",
      "diagram_label": "GI 1/3",
      "media": "copper",
      "connects_to": {
        "device": "Server",
        "port": "Port 1",
        "kind": "device"
      },
      "expect": {
        "link": "up"
      }
    },
    {
      "interface": "GigabitEthernet1/5",
      "diagram_label": "GI 1/5",
      "media": "copper",
      "connects_to": {
        "device": "Server",
        "port": "Port 2",
        "kind": "device"
      },
      "expect": {
        "link": "up"
      }
    },
    {
      "interface": "GigabitEthernet1/7",
      "diagram_label": "GI 1/7",
      "media": "copper",
      "connects_to": {
        "device": "Server",
        "port": "Port 3",
        "kind": "device"
      },
      "expect": {
        "link": "up"
      }
    },
    {
      "interface": "GigabitEthernet1/9",
      "diagram_label": "GI 1/9",
      "media": "copper",
      "connects_to": {
        "device": "Server",
        "port": "Port 4",
        "kind": "device"
      },
      "expect": {
        "link": "up"
      }
    },
    {
      "interface": "GigabitEthernet1/8",
      "diagram_label": "GI 1/8",
      "media": "copper",
      "connects_to": {
        "device": "UPS",
        "port": null,
        "kind": "device"
      },
      "expect": {
        "link": "up"
      }
    },
    {
      "interface": "TenGigabitEthernet1/1",
      "diagram_label": "TE 1/1",
      "media": "fiber",
      "connects_to": {
        "device": "Fiber Bulkhead (4-channel multimode)",
        "port": "P1/S1",
        "kind": "bulkhead"
      },
      "optic": {
        "part_number": "SFP-10GSR-85I",
        "vendor": "FS.com",
        "compatible_with": "Cisco SFP-10G-SR-I",
        "type": "10GBASE-SR",
        "wavelength_nm": 850,
        "fiber": "multimode",
        "datasheet": "https://img-en.fs.com/file/datasheet/10g-sr-i.pdf"
      },
      "expect": {
        "link": "optional",
        "light_levels_dbm": {
          "use_module_thresholds": true,
          "tx": {
            "min": -6.0,
            "max": -1.0
          },
          "rx": {
            "min": -11.1,
            "max": 0.5
          }
        }
      },
      "note": "Fiber bulkhead channel P1/S1. Link is optional because the far end of the bulkhead may be empty during a single-switch test; when link is up, light levels are checked."
    },
    {
      "interface": "TenGigabitEthernet1/2",
      "diagram_label": "TE 1/2",
      "media": "fiber",
      "connects_to": {
        "device": "Fiber Bulkhead (4-channel multimode)",
        "port": "P2/S2",
        "kind": "bulkhead"
      },
      "optic": {
        "part_number": "SFP-10GSR-85I",
        "vendor": "FS.com",
        "compatible_with": "Cisco SFP-10G-SR-I",
        "type": "10GBASE-SR",
        "wavelength_nm": 850,
        "fiber": "multimode",
        "datasheet": "https://img-en.fs.com/file/datasheet/10g-sr-i.pdf"
      },
      "expect": {
        "link": "optional",
        "light_levels_dbm": {
          "use_module_thresholds": true,
          "tx": {
            "min": -6.0,
            "max": -1.0
          },
          "rx": {
            "min": -11.1,
            "max": 0.5
          }
        }
      },
      "note": "Fiber bulkhead channel P2/S2. Link is optional because the far end of the bulkhead may be empty during a single-switch test; when link is up, light levels are checked."
    },
    {
      "interface": "GigabitEthernet1/4",
      "diagram_label": "GI 1/4",
      "media": "copper",
      "connects_to": {
        "device": "Bulkhead RJ-45",
        "port": "1-J5",
        "kind": "bulkhead"
      },
      "expect": {
        "link": "optional"
      },
      "note": "Passive bulkhead. Link only comes up when something is plugged into the outside of the bulkhead, so link is optional."
    },
    {
      "interface": "GigabitEthernet1/6",
      "diagram_label": "GI 1/6",
      "media": "copper",
      "connects_to": {
        "device": "Bulkhead RJ-45",
        "port": "1-J6",
        "kind": "bulkhead"
      },
      "expect": {
        "link": "optional"
      },
      "note": "Passive bulkhead. Link only comes up when something is plugged into the outside of the bulkhead, so link is optional."
    },
    {
      "interface": "GigabitEthernet2/1",
      "diagram_label": "GI 2/1",
      "media": "copper",
      "connects_to": {
        "device": "Bulkhead RJ-45",
        "port": "1-J7",
        "kind": "bulkhead"
      },
      "expect": {
        "link": "optional"
      },
      "note": "Passive bulkhead. Link only comes up when something is plugged into the outside of the bulkhead, so link is optional."
    },
    {
      "interface": "GigabitEthernet2/2",
      "diagram_label": "GI 2/2",
      "media": "copper",
      "connects_to": {
        "device": "Bulkhead RJ-45",
        "port": "1-J8",
        "kind": "bulkhead"
      },
      "expect": {
        "link": "optional"
      },
      "note": "Passive bulkhead. Link only comes up when something is plugged into the outside of the bulkhead, so link is optional."
    },
    {
      "interface": "GigabitEthernet2/3",
      "diagram_label": "GI 2/3",
      "media": "copper",
      "connects_to": {
        "device": "Bulkhead RJ-45",
        "port": "1-J9",
        "kind": "bulkhead"
      },
      "expect": {
        "link": "optional"
      },
      "note": "Passive bulkhead. Link only comes up when something is plugged into the outside of the bulkhead, so link is optional."
    },
    {
      "interface": "GigabitEthernet2/4",
      "diagram_label": "GI 2/4",
      "media": "copper",
      "connects_to": {
        "device": "Bulkhead RJ-45",
        "port": "1-J10",
        "kind": "bulkhead"
      },
      "expect": {
        "link": "optional"
      },
      "note": "Passive bulkhead. Link only comes up when something is plugged into the outside of the bulkhead, so link is optional."
    },
    {
      "interface": "GigabitEthernet2/5",
      "diagram_label": "GI 2/5",
      "media": "copper",
      "connects_to": {
        "device": "Bulkhead RJ-45",
        "port": "1-J11",
        "kind": "bulkhead"
      },
      "expect": {
        "link": "optional"
      },
      "note": "Passive bulkhead. Link only comes up when something is plugged into the outside of the bulkhead, so link is optional."
    },
    {
      "interface": "GigabitEthernet2/6",
      "diagram_label": "GI 2/6",
      "media": "copper",
      "connects_to": {
        "device": "Bulkhead RJ-45",
        "port": "1-J12",
        "kind": "bulkhead"
      },
      "expect": {
        "link": "optional"
      },
      "note": "Passive bulkhead. Link only comes up when something is plugged into the outside of the bulkhead, so link is optional."
    },
    {
      "interface": "GigabitEthernet2/7",
      "diagram_label": "GI 2/7",
      "media": "copper",
      "connects_to": {
        "device": "Bulkhead RJ-45",
        "port": "1-J14",
        "kind": "bulkhead"
      },
      "expect": {
        "link": "optional"
      },
      "note": "Passive bulkhead. Link only comes up when something is plugged into the outside of the bulkhead, so link is optional."
    },
    {
      "interface": "GigabitEthernet2/8",
      "diagram_label": "GI 2/8",
      "media": "copper",
      "connects_to": {
        "device": "Bulkhead RJ-45",
        "port": "1-J15",
        "kind": "bulkhead"
      },
      "expect": {
        "link": "optional"
      },
      "note": "Passive bulkhead. Link only comes up when something is plugged into the outside of the bulkhead, so link is optional."
    }
  ]
}
